ID;list_code;list_name;jurisdiction;description;last_update;version;source_url;update_frequency;entity_count;is_active;created_at;created_by;modified_at;modified_by
550e8400-e29b-41d4-a716-446655441001;OFAC_SDN;OFAC Specially Designated Nationals List;US;US Treasury OFAC SDN List - primary US sanctions list;2026-01-15T00:00:00Z;2026.01.15;https://sanctionssearch.ofac.treas.gov/;WEEKLY;1250;true;2025-01-01T00:00:00Z;compliance.officer@airline.com;2026-01-15T08:00:00Z;compliance.officer@airline.com
550e8400-e29b-41d4-a716-446655441002;OFAC_CONS;OFAC Consolidated Sanctions List;US;US Treasury OFAC Consolidated List - combined sanctions;2026-01-15T00:00:00Z;2026.01.15;https://sanctionssearch.ofac.treas.gov/;WEEKLY;2100;true;2025-01-01T00:00:00Z;compliance.officer@airline.com;2026-01-15T08:00:00Z;compliance.officer@airline.com
550e8400-e29b-41d4-a716-446655441003;EU_CFT;EU Consolidated Financial Sanctions List;EU;European Union consolidated list of persons and entities subject to financial sanctions;2026-01-12T00:00:00Z;2026.01.12;https://data.europa.eu/data/datasets/consolidated-list;WEEKLY;980;true;2025-01-01T00:00:00Z;compliance.officer@airline.com;2026-01-12T09:00:00Z;compliance.officer@airline.com
550e8400-e29b-41d4-a716-446655441004;UN_SC;UN Security Council Consolidated List;UN;United Nations Security Council sanctions list;2026-01-10T00:00:00Z;2026.01.10;https://www.un.org/securitycouncil/content/un-sc-consolidated-list;MONTHLY;750;true;2025-01-01T00:00:00Z;compliance.officer@airline.com;2026-01-10T10:00:00Z;compliance.officer@airline.com
550e8400-e29b-41d4-a716-446655441005;UK_OFSI;UK OFSI Consolidated List;UK;UK Office of Financial Sanctions Implementation consolidated list;2026-01-14T00:00:00Z;2026.01.14;https://www.gov.uk/government/publications/financial-sanctions-consolidated-list;WEEKLY;850;true;2025-01-01T00:00:00Z;compliance.officer@airline.com;2026-01-14T11:00:00Z;compliance.officer@airline.com